<Defs xmlns:xsi="http://www.w3.org/2001/XMLSchema-instance" xsi:noNamespaceSchemaLocation="../../../../Schemas/MorphDef.xsd">
	<Pawnmorph.MorphDef ParentName="FoxMorphBase">
		<defName>FoxMorph</defName>
		<label>foxmorph</label>
		<race>Fox_Red</race>
		<categories>
			<li>Temperate</li>
			<li>Combat</li>
			<li>Social</li>
			<li>Canid</li>
		</categories>
		<partialTransformation>PawnmorphFoxTFPartial</partialTransformation>
		<fullTransformation>PawnmorphFoxTF</fullTransformation>
		<raceSettings>
			<graphicsSettings>
				<skinColorOverride>(178,99,33)</skinColorOverride>
			</graphicsSettings>
		</raceSettings>
	</Pawnmorph.MorphDef>
</Defs>