<Defs xmlns:xsi="http://www.w3.org/2001/XMLSchema-instance" xsi:noNamespaceSchemaLocation="../../../../../../../../../Schemas/MorphDef.xsd">
	<Pawnmorph.MorphDef ParentName="FamiliarisMorph">
		<defName>LabradorRetrieverMorph</defName>
		<label>labmorph</label>
		<race>LabradorRetriever</race>
		<fullTransformation>PawnmorphLabradorRetrieverTF</fullTransformation>
		<partialTransformation>PawnmorphLabradorRetrieverTFPartial</partialTransformation>
		<raceSettings>
			<graphicsSettings>
				<skinColorOverride>(220,198,160)</skinColorOverride>
			</graphicsSettings>
		</raceSettings>
	</Pawnmorph.MorphDef>
</Defs>