<Defs xmlns:xsi="http://www.w3.org/2001/XMLSchema-instance" xsi:noNamespaceSchemaLocation="../../../../../../Schemas/MorphDef.xsd">
	<Pawnmorph.MorphDef Abstract="true" ParentName="PawFootedMorph" Name="UrsineMorph">
		<description>Bearmorphs are combat experts. Usually equipped with large claws, paws and maws, they are devastatingly dangerous up close. But they have a tender heart, and a soft spot for plush toys of the ursine variety.</description>
		<classification>Ursine</classification>
		<categories>
			<li>Combat</li>
		</categories>
		<transformSettings>
			<transformationMemory>BearTransformationMemory</transformationMemory>
			<revertedMemory>BearRevertedMemory</revertedMemory>
		</transformSettings>
	</Pawnmorph.MorphDef>
</Defs>
